{
  "summary": {
    "sessionId": "cl_733b51a7-b861-4e1c-98b2-5af241fede0f",
    "provider": "claude",
    "title": "Fix sidebar jitter",
    "titleSource": "workbook",
    "projectId": "ws_mm9x2",
    "folderId": null,
    "workingDir": "C:\\Users\\dev\\Projects\\myrlin-ios",
    "branch": "main",
    "owner": "workbook",
    "state": "working",
    "stateEnteredAtMs": 1790000100000,
    "needsYou": false,
    "lastActiveAtMs": 1790000100000,
    "createdAtMs": 1789990000000,
    "model": "claude-opus-5-5",
    "tracked": true,
    "workbookSessionId": "mm9x2k",
    "upstreamId": "733b51a7-b861-4e1c-98b2-5af241fede0f",
    "pinned": false,
    "archived": false,
    "tabGroupIds": [
      "tg_default"
    ],
    "lineage": null,
    "preview": "Running the unit tests again after the fix.",
    "sizeBytes": 5900000
  },
  "meta": {
    "sessionId": "cl_733b51a7-b861-4e1c-98b2-5af241fede0f",
    "title": "Fix sidebar jitter",
    "titleSource": "workbook",
    "provider": "claude",
    "model": "claude-opus-5-5",
    "effort": "high",
    "permissionMode": "bypassPermissions",
    "sandbox": null,
    "approvalPolicy": null,
    "workingDir": "C:\\Users\\dev\\Projects\\myrlin-ios",
    "branch": "main",
    "owner": "workbook",
    "ownerDetail": null,
    "live": true,
    "projectId": "ws_mm9x2",
    "folderId": null,
    "tabGroupIds": [
      "tg_default"
    ],
    "pinned": false,
    "archived": false,
    "lineage": null,
    "settingsPendingRestart": false,
    "readOnlyReason": null,
    "supersededBy": null,
    "sizeBytes": 5900000,
    "formatDrift": false
  },
  "state": {
    "sessionId": "cl_733b51a7-b861-4e1c-98b2-5af241fede0f",
    "state": "working",
    "enteredAtMs": 1790000100000,
    "turnId": "t_5b7c0d2e-1f3a-4c55-9e0a-7d2b1c9f8e61",
    "turnStartedAtMs": 1790000088000,
    "toolName": "Bash",
    "detail": "npm test",
    "source": "transcript",
    "lastActivityAtMs": 1790000100000,
    "queuedSends": 0,
    "estimatedThinkingTokens": null
  },
  "turn": {
    "sessionId": "cl_733b51a7-b861-4e1c-98b2-5af241fede0f",
    "turnId": "t_5b7c0d2e-1f3a-4c55-9e0a-7d2b1c9f8e61",
    "source": "phone",
    "deviceId": "d_TViQs70r__UO4o8s844E",
    "clientMessageId": "0f8f2d8e-5d0b-4c47-9a3e-2b6f5c9d1e7a",
    "startedAtMs": 1790000088000,
    "endedAtMs": null,
    "status": "running",
    "durationMs": null,
    "endSource": null,
    "stoppedBy": null,
    "error": null
  },
  "openPrompts": [
    {
      "promptId": "p_Yh3kPz0qLm8vN2cR5tW9",
      "sessionId": "cl_733b51a7-b861-4e1c-98b2-5af241fede0f",
      "kind": "question",
      "openedAtMs": 1790000120000,
      "source": "screenAndTranscript",
      "title": "Claude has a question",
      "detail": null,
      "toolName": "AskUserQuestion",
      "toolCallId": "toolu_01ABC",
      "questions": [
        {
          "index": 0,
          "header": "Search",
          "question": "Build a full text index for search?",
          "multiSelect": false,
          "allowOther": true,
          "options": [
            {
              "index": 0,
              "key": "1",
              "label": "Build the index (Recommended)",
              "description": "Worker thread, SQLite FTS5.",
              "recommended": true,
              "role": "neutral"
            },
            {
              "index": 1,
              "key": "2",
              "label": "Tail only",
              "description": "Keep today's search.",
              "recommended": false,
              "role": "neutral"
            }
          ]
        }
      ],
      "options": [],
      "currentQuestionIndex": 0,
      "consequence": null,
      "answerable": true,
      "rawScreen": null,
      "fingerprint": "Q2xhdWRlIGhhcyBh"
    }
  ],
  "sends": [
    {
      "clientMessageId": "0f8f2d8e-5d0b-4c47-9a3e-2b6f5c9d1e7a",
      "sessionId": "cl_733b51a7-b861-4e1c-98b2-5af241fede0f",
      "deviceId": "d_TViQs70r__UO4o8s844E",
      "state": "queued",
      "reason": "busy",
      "position": 1,
      "textPreview": "Run the tests again.",
      "attachmentCount": 0,
      "queuedAtMs": 1790000130000,
      "writtenAtMs": null,
      "deliveredAtMs": null,
      "confirmedAtMs": null,
      "messageId": null,
      "error": null
    }
  ],
  "streamEpoch": "e_kJGSk5SVlpeYmZqb",
  "streamSeq": 1204
}
